{
  "$schema": "http://json-schema.org/draft-07/schema#",
  "type": "object",
  "properties": {
    "id": {
      "type": "string"
    },
    "name": {
      "type": "string"
    },
    "version": {
      "type": "string"
    },
    "globalStateSchema": {
      "$ref": "#/definitions/__schema0"
    },
    "globalState": {
      "type": "object",
      "propertyNames": {
        "type": "string"
      },
      "additionalProperties": {}
    },
    "steps": {
      "type": "array",
      "items": {
        "type": "object",
        "properties": {
          "id": {
            "type": "string"
          },
          "name": {
            "type": "string"
          },
          "type": {
            "type": "string",
            "enum": [
              "begin",
              "end",
              "task",
              "decision"
            ]
          },
          "paramsSchema": {
            "allOf": [
              {
                "$ref": "#/definitions/__schema0"
              }
            ]
          },
          "params": {
            "type": "object",
            "propertyNames": {
              "type": "string"
            },
            "additionalProperties": {}
          },
          "metadata": {
            "type": "object",
            "propertyNames": {
              "type": "string"
            },
            "additionalProperties": {}
          }
        },
        "required": [
          "id",
          "name",
          "type"
        ]
      }
    },
    "connections": {
      "type": "array",
      "items": {
        "type": "object",
        "properties": {
          "id": {
            "type": "string"
          },
          "sourceStepId": {
            "type": "string"
          },
          "targetStepId": {
            "type": "string"
          },
          "condition": {
            "type": "string"
          }
        },
        "required": [
          "id",
          "sourceStepId",
          "targetStepId"
        ]
      }
    },
    "metadata": {
      "type": "object",
      "propertyNames": {
        "type": "string"
      },
      "additionalProperties": {}
    }
  },
  "required": [
    "id",
    "name",
    "version",
    "globalStateSchema",
    "steps",
    "connections"
  ],
  "definitions": {
    "__schema0": {
      "type": "object",
      "properties": {
        "type": {
          "type": "string",
          "enum": [
            "string",
            "number",
            "integer",
            "boolean",
            "object",
            "array",
            "null"
          ]
        },
        "format": {
          "type": "string"
        },
        "enum": {
          "type": "array",
          "items": {
            "type": "string"
          }
        },
        "properties": {
          "type": "object",
          "propertyNames": {
            "type": "string"
          },
          "additionalProperties": {
            "$ref": "#/definitions/__schema0"
          }
        },
        "items": {
          "allOf": [
            {
              "$ref": "#/definitions/__schema0"
            }
          ]
        },
        "required": {
          "type": "array",
          "items": {
            "type": "string"
          }
        }
      },
      "additionalProperties": {}
    }
  }
}